{
  "contract_type": "step-execution",
  "contract_version": "1.1.0",
  "step_id": "STEP-000000000001",
  "run_id": "RUN-000000000001",
  "skill_id": "quick-review",
  "skill_version": "1.0.0",
  "phase": "review",
  "sequence": 0,
  "status": "succeeded",
  "started_at": "2026-08-16T22:00:10Z",
  "completed_at": "2026-08-16T22:01:50Z",
  "duration_ms": 100000,
  "input_artifact_ids": [],
  "output_artifact_ids": ["ART-000000000001"],
  "policy_decision_id": "POL-000000000001",
  "gate_decision_id": "GATE-000000000001",
  "attempt": 1,
  "retryable": false,
  "retry_reason": null,
  "budget": {
    "max_attempts": 3,
    "max_tool_calls": 1,
    "max_elapsed_ms": 60000,
    "max_input_tokens": 0,
    "max_output_tokens": 0,
    "max_estimated_cost_usd": 0,
    "consumed_attempts": 1,
    "consumed_tool_calls": 1,
    "consumed_elapsed_ms": 0,
    "consumed_input_tokens": 0,
    "consumed_output_tokens": 0,
    "consumed_estimated_cost_usd": 0,
    "exhausted": false,
    "exhausted_dimension": null
  },
  "error": null,
  "metrics": { "input_tokens": 1200, "output_tokens": 800, "tool_calls": 2, "estimated_cost_usd": 0.04 },
  "pii_scrubbed": true
}
